index	answer	text
0	Yes	b. Notwithstanding the foregoing, the parties' duty to hold in confidence Confidential Information that was disclosed during term shall remain in effect indefinitely. 
1	Yes	Confidentiality obligations shall survive termination of this Agreement for the Period of Confidentiality set forth above unless the Confidential Information is a trade secret, in which case the confidentiality obligations shall continue for as long as the information is a trade secret.  Sections 1, 2, 3, 4, 5, 6, 17, 18, 19 and any sections (or parts thereof) which, by their nature, are intended to survive termination shall survive termination of this Agreement. 
2	Yes	8. The undertakings in clauses 2 and 3 will continue in force indefinitely. 
3	Yes	The obligations of the Receiving Party under this Agreement shall survive the termination of this Agreement or the return of the Confidential Information to the Disclosing Party. 
4	No	This Agreement and Recipient’s obligation to keep Confidential Information confidential expires three (3) years after the Effective Date. 
5	No	Without granting any right or license, the Disclosing Party agrees that the foregoing clauses  (i),  (ii),  (iii) and  (v) shall not apply with respect to all obligations after five (5) years following the disclosure thereof or any information that the Receiving Party can document  
6	No	The terms of this section “Use of Evaluation Materials” shall remain in effect for 2 years from the effective date of this agreement. The terms of this section “Non-Disclosure” shall remain in effect for 2 years from the effective date of this agreement. 
7	No	9. This Agreement shall expire and cease to have any force or effect on the earlier of  (i) eighteen months from the date hereof or  (ii) the date of consummation of a transaction between the parties. 
